<?xml version="1.0" encoding="UTF-8"?>
<GCMDeployment 
	xmlns="urn:gcm:deployment:1.0"
	xmlns:xsi="http://www.w3.org/2001/XMLSchema-instance"
	xsi:schemaLocation="urn:gcm:deployment:1.0 /home/glaurent/workspace/proactive_trunk/src/Extra/org/objectweb/proactive/extra/gcmdeployment/schema/DeploymentDescriptorSchema.xsd	">

	<resources>
		<group refid="WRONG_ID">
			<host refid="myhost" />
		</group>
	</resources>

	<infrastructure>
	
		<groups>
			<sshGroup id="mygroup" hostList="host" />
		</groups>

		<hosts>
			<host id="myhost" os="unix">
				<homeDirectory base="root" relpath="" />
			</host>
		</hosts>

	</infrastructure>

</GCMDeployment>
