<?xml version="1.0" encoding="UTF-8"?>
<GCMDeployment xmlns="http://www-sop.inria.fr/oasis/ProActive/schemas"
	xmlns:xsi="http://www.w3.org/2001/XMLSchema-instance"
	xmlns:paext="http://www-sop.inria.fr/oasis/ProActive/schemas/DeploymentDescriptorSchemaExtension"
	xmlns:pa="http://www-sop.inria.fr/oasis/ProActive/schemas"	
	xsi:schemaLocation="http://www-sop.inria.fr/oasis/ProActive/schemas                 ../../../../../Extra/org/objectweb/proactive/extra/gcmdeployment/schema/DeploymentDescriptorSchema.xsd
	http://www-sop.inria.fr/oasis/ProActive/schemas/DeploymentDescriptorSchemaExtension ../../../../../Extra/org/objectweb/proactive/extra/gcmdeployment/schema/ExtensionSchemas.xsd

	">

	<environment>
		<descriptorVariable name="USERNAME" value="cmathieu" />
	</environment>

	<resources>
		<bridge refid="SEA" />

		<group refid="LAN_INRIA">
			<host refid="INRIA_x86_64" />
		</group>
	</resources>

	<infrastructure>
		<hosts>
			<host id="INRIA_x86_64" os="unix" hostCapacity="4" vmCapacity="2">
				<homeDirectory base="root" relpath="/user/${USERNAME}/home" />
				<tool id="java" path="/usr/java/j2sdk/bin/java" />
				<tool id="proactive" path="$HOME/myApps/ProActive_3.2.1" />
			</host>
		</hosts>

		<groups>
			<paext:sshGroup id="LAN_INRIA" hostList="cheypa schubby petawawa naruto" username="${USERNAME}"
				commandPath="/usr/local/bin/ssh">
			</paext:sshGroup>
		</groups>

		<bridges>
			<paext:sshBridge id="SEA" hostname="sea.inria.fr" username="${USERNAME}" commandPath="" />
		</bridges>
	</infrastructure>

</GCMDeployment>